[
 {
  "id": "ar00",
  "arcana": "major",
  "number": 0,
  "name": {
   "pl": "Głupiec",
   "en": "The Fool"
  },
  "up": {
   "keywords": {
    "pl": [
     "początek",
     "ufność",
     "nowa droga"
    ],
    "en": [
     "beginning",
     "trust",
     "new road"
    ]
   },
   "sentences": {
    "pl": [
     "Krok w nieznane już zrobiony, a strach jakoś nie nadszedł.",
     "Pomysł jest świeży, a plan dopiero się rysuje."
    ],
    "en": [
     "A step into the unknown is taken, and fear has not turned up.",
     "The idea is fresh, and the plan is still being drawn."
    ]
   }
  },
  "rev": {
   "keywords": {
    "pl": [
     "lekkomyślność",
     "brak planu",
     "naiwność"
    ],
    "en": [
     "recklessness",
     "no plan",
     "naivety"
    ]
   },
   "sentences": {
    "pl": [
     "Skok bez patrzenia pod nogi, a ludzie przyglądają się z boku.",
     "Wszystko wygląda świeżo, lecz bez planu łatwo zgubić kierunek."
    ],
    "en": [
     "A leap with no look at the ground, and onlookers wince.",
     "Everything looks fresh, but without a plan the direction is easily lost."
    ]
   }
  },
  "business": {
   "pl": "Przed kolejnym krokiem przyda się pakiet startowy dla młodej firmy.",
   "en": "Before the next step, a young company could use a launch package."
  },
  "services": [
   "startup"
  ]
 },
 {
  "id": "ar01",
  "arcana": "major",
  "number": 1,
  "name": {
   "pl": "Mag",
   "en": "The Magician"
  },
  "up": {
   "keywords": {
    "pl": [
     "umiejętność",
     "sprawczość",
     "skupienie"
    ],
    "en": [
     "skill",
     "agency",
     "focus"
    ]
   },
   "sentences": {
    "pl": [
     "Narzędzia leżą na stole, a firma wie, jak po nie sięgnąć.",
     "Każdy element marki zadziała, gdy trafi na swoje miejsce."
    ],
    "en": [
     "Tools lie on the table, and the company knows how to reach for them.",
     "Every brand element works once it lands in its place."
    ]
   }
  },
  "rev": {
   "keywords": {
    "pl": [
     "manipulacja",
     "zmarnowany potencjał",
     "blef"
    ],
    "en": [
     "manipulation",
     "wasted potential",
     "bluff"
    ]
   },
   "sentences": {
    "pl": [
     "Obietnice cudów kończą się pustym pudełkiem w rękach klienta.",
     "Sztuczki działają raz, a zaufanie znika za drugim razem."
    ],
    "en": [
     "Promises of miracles end in an empty box in the client's hands.",
     "Tricks work once, and trust disappears the second time."
    ]
   }
  },
  "business": {
   "pl": "Dobre pomysły czekają na spójną identyfikację wizualną, która je uwiarygodni.",
   "en": "Good ideas are waiting for a coherent visual identity to make them credible."
  },
  "services": [
   "identity"
  ]
 },
 {
  "id": "ar02",
  "arcana": "major",
  "number": 2,
  "name": {
   "pl": "Najwyższa Kapłanka",
   "en": "The High Priestess"
  },
  "up": {
   "keywords": {
    "pl": [
     "intuicja",
     "ukryta wiedza",
     "cierpliwość"
    ],
    "en": [
     "intuition",
     "hidden knowledge",
     "patience"
    ]
   },
   "sentences": {
    "pl": [
     "Za zamkniętymi drzwiami leży wiedza o klientach, której nikt nie spisał.",
     "Cisza w zespole bywa mądrzejsza od hałasu w kampaniach."
    ],
    "en": [
     "Behind closed doors lies knowledge about clients that nobody has written down.",
     "Silence in the team can be wiser than noise in campaigns."
    ]
   }
  },
  "rev": {
   "keywords": {
    "pl": [
     "ukryte intencje",
     "tajemnica",
     "sekrety w szufladzie"
    ],
    "en": [
     "hidden motives",
     "secrecy",
     "secrets in a drawer"
    ]
   },
   "sentences": {
    "pl": [
     "Dane leżą w szufladzie, a decyzje zapadają na czuja.",
     "Zbyt wiele tajemnic sprawia, że klienci zaczynają zgadywać."
    ],
    "en": [
     "Data sits in a drawer while decisions are made by gut feeling.",
     "Too many secrets make clients start guessing."
    ]
   }
  },
  "business": {
   "pl": "Wiedza, której strona jeszcze nie pokazuje, czeka na przemyślany UX i UI.",
   "en": "Knowledge your site does not yet show is waiting for thoughtful UX and UI."
  },
  "services": [
   "uxui"
  ]
 },
 {
  "id": "ar03",
  "arcana": "major",
  "number": 3,
  "name": {
   "pl": "Cesarzowa",
   "en": "The Empress"
  },
  "up": {
   "keywords": {
    "pl": [
     "obfitość",
     "wzrost",
     "troska"
    ],
    "en": [
     "abundance",
     "growth",
     "nurture"
    ]
   },
   "sentences": {
    "pl": [
     "Wszystko kwitnie, a z każdej grządki wyrasta coś nowego.",
     "Klienci chętnie wracają tam, gdzie czują się zauważeni."
    ],
    "en": [
     "Everything blossoms, and something new grows from every bed.",
     "Clients gladly return where they feel noticed."
    ]
   }
  },
  "rev": {
   "keywords": {
    "pl": [
     "przesyt",
     "zaniedbanie",
     "jałowość"
    ],
    "en": [
     "excess",
     "neglect",
     "barrenness"
    ]
   },
   "sentences": {
    "pl": [
     "Ogród zarasta chwastami, bo nikt nie pamięta o podlewaniu.",
     "Dużo się dzieje, ale nowi klienci nie mają dokąd wejść."
    ],
    "en": [
     "Weeds take the garden because nobody remembers to water it.",
     "A lot happens, yet new clients have nowhere to step in."
    ]
   }
  },
  "business": {
   "pl": "Pora na stronę www, która zaprosi nowych klientów do środka.",
   "en": "Time for a website that invites new clients inside."
  },
  "services": [
   "website"
  ]
 },
 {
  "id": "ar04",
  "arcana": "major",
  "number": 4,
  "name": {
   "pl": "Cesarz",
   "en": "The Emperor"
  },
  "up": {
   "keywords": {
    "pl": [
     "porządek",
     "struktura",
     "stabilność"
    ],
    "en": [
     "order",
     "structure",
     "stability"
    ]
   },
   "sentences": {
    "pl": [
     "Fundamenty są mocne, a każda cegła leży równo.",
     "Reguły są jasne, więc klienci wiedzą, czego się spodziewać."
    ],
    "en": [
     "Strong foundations are laid, and every brick sits level.",
     "The rules are clear, so clients know what to expect."
    ]
   }
  },
  "rev": {
   "keywords": {
    "pl": [
     "sztywność",
     "kontrola na siłę",
     "rozpad ładu"
    ],
    "en": [
     "rigidity",
     "forced control",
     "broken order"
    ]
   },
   "sentences": {
    "pl": [
     "Zasady są tak ciasne, że zespół przestaje się nimi przejmować.",
     "Zbyt duża kontrola odstrasza klientów, zanim zdążą cokolwiek kupić."
    ],
    "en": [
     "Rules this tight make the team stop caring about them.",
     "Too much control scares clients away before they buy anything."
    ]
   }
  },
  "business": {
   "pl": "Potrzeba porządku: spójnego systemu wizualnego, który powtarza się w każdym miejscu.",
   "en": "What is needed is order: a consistent visual system that repeats everywhere."
  },
  "services": [
   "identity"
  ]
 },
 {
  "id": "ar05",
  "arcana": "major",
  "number": 5,
  "name": {
   "pl": "Najwyższy Kapłan",
   "en": "The Hierophant"
  },
  "up": {
   "keywords": {
    "pl": [
     "tradycja",
     "standardy",
     "zaufanie instytucji"
    ],
    "en": [
     "tradition",
     "standards",
     "institutional trust"
    ]
   },
   "sentences": {
    "pl": [
     "Klienci szukają znajomych zasad i wiarygodnego głosu.",
     "Dobre konwencje oszczędzają czas, bo wszyscy wiedzą, czego się spodziewać."
    ],
    "en": [
     "Clients look for familiar rules and a credible voice.",
     "Good conventions save time because everyone knows what to expect."
    ]
   }
  },
  "rev": {
   "keywords": {
    "pl": [
     "bunt przeciw normom",
     "zerwanie konwencji",
     "nieprzystawalność"
    ],
    "en": [
     "rebellion",
     "broken convention",
     "mismatch"
    ]
   },
   "sentences": {
    "pl": [
     "Dawne zasady poszły do kosza, a klienci gubią się w nowym języku.",
     "Modny wygląd bez wiarygodności szybko okazuje się pustą dekoracją."
    ],
    "en": [
     "Old rules have been thrown out, and clients lose their way in the new language.",
     "A trendy look without credibility quickly turns into empty decoration."
    ]
   }
  },
  "business": {
   "pl": "Firma potrzebuje identyfikacji, która mówi językiem branży, ale brzmi po swojemu.",
   "en": "Your brand needs an identity that speaks the industry's language yet still sounds like itself."
  },
  "services": [
   "identity"
  ]
 },
 {
  "id": "ar06",
  "arcana": "major",
  "number": 6,
  "name": {
   "pl": "Kochankowie",
   "en": "The Lovers"
  },
  "up": {
   "keywords": {
    "pl": [
     "wybór",
     "spójność",
     "więź"
    ],
    "en": [
     "choice",
     "harmony",
     "bond"
    ]
   },
   "sentences": {
    "pl": [
     "Stoisz przed wyborem, który zdefiniuje, kim jest wasza marka.",
     "Dwie połówki w końcu chcą wyglądać jak jedna całość."
    ],
    "en": [
     "You stand before a choice that will define who your brand is.",
     "Two halves at last want to look like one whole."
    ]
   }
  },
  "rev": {
   "keywords": {
    "pl": [
     "rozdźwięk",
     "niespójność",
     "wahanie"
    ],
    "en": [
     "discord",
     "inconsistency",
     "doubt"
    ]
   },
   "sentences": {
    "pl": [
     "Marka mówi jednym głosem, a wygląda jak trzy różne.",
     "Klienci nie wiedzą, komu właściwie zaufali."
    ],
    "en": [
     "A single voice wears three different faces.",
     "Clients cannot tell whom they have actually trusted."
    ]
   }
  },
  "business": {
   "pl": "Marce brakuje jednego, spójnego oblicza.",
   "en": "Your brand needs one coherent face."
  },
  "services": [
   "identity"
  ]
 },
 {
  "id": "ar07",
  "arcana": "major",
  "number": 7,
  "name": {
   "pl": "Rydwan",
   "en": "The Chariot"
  },
  "up": {
   "keywords": {
    "pl": [
     "pęd",
     "wola",
     "zwycięstwo"
    ],
    "en": [
     "drive",
     "will",
     "victory"
    ]
   },
   "sentences": {
    "pl": [
     "Wóz rusza z miejsca i chce jechać szybciej, niż pozwala droga.",
     "Dwa sfinksy ciągną w tę samą stronę. To rzadkie."
    ],
    "en": [